<?xml version="1.0"?>
<!DOCTYPE Report
[
<!ELEMENT Report (General ,(Doc|BPT)) >
<!ATTLIST Report ver CDATA #REQUIRED tmZone CDATA #REQUIRED>

<!ELEMENT General ( DocLocation ) >
<!ATTLIST General productName CDATA #REQUIRED productVer CDATA #REQUIRED os CDATA #REQUIRED host CDATA #REQUIRED qcserver CDATA #IMPLIED qcproject CDATA #IMPLIED SolManSolutionId CDATA #IMPLIED SolManProjectId CDATA #IMPLIED SolManTestPlanId CDATA #IMPLIED SolManTestPackageId CDATA #IMPLIED SolManUserInfoData CDATA #IMPLIED  >

<!ELEMENT BPT (DName,Res,DVer?,TSet?,TInst?,NodeArgs,AdditionalInfo*,Doc*) >
<!ATTLIST BPT rID ID #REQUIRED >

<!ELEMENT Doc (DName,ConfName?,Res,DVer?,TSet?,TInst?,RunType?,DT?,AdditionalInfo*,Step*,DIter*,Step*,Action*,Doc*,Summary?,TestMaintenanceSummary*,NodeArgs?) >
<!ATTLIST Doc rID ID #REQUIRED type (Test|BC|BPTWrapperTest|Flow|Group|Action) "Test" productName CDATA #REQUIRED BCIter CDATA #IMPLIED >

<!ELEMENT RunType ( #PCDATA )>
<!ATTLIST RunType fmStep (False|True) "False" batch (False|True) "False" upDesc (False|True) "False" upChk (False|True) "False" upAS (False|True) "False">

<!ELEMENT DName ( #PCDATA ) >

<!ELEMENT ConfName ( #PCDATA ) >

<!ELEMENT Res ( #PCDATA ) >

<!ELEMENT AdditionalInfo (AdditionalDataName,AdditionalDataValue ) >

<!ELEMENT AdditionalDataName ( #PCDATA ) >

<!ELEMENT AdditionalDataValue ( #PCDATA ) >

<!ELEMENT DVer ( #PCDATA ) >

<!ELEMENT TSet ( #PCDATA ) >

<!ELEMENT TInst ( #PCDATA ) >

<!ELEMENT DIter (Step*,Action+,Summary?,NodeArgs)>
<!ATTLIST DIter rID ID #REQUIRED iterID CDATA #REQUIRED>

<!ELEMENT DocLocation ( #PCDATA )>

<!ELEMENT Action (AName,AIter*,(Step|HtmlStep|Action)*, Summary,ActionMaintenanceSummary*, NodeArgs ) >
<!ATTLIST Action rID ID #REQUIRED>

<!ELEMENT AIter ((Step|HtmlStep|Action)*,DataMapping?, Summary?,NodeArgs) >
<!ATTLIST AIter rID ID #REQUIRED iterID CDATA #REQUIRED isCountable (False|True) "False" >

<!ELEMENT AName ( #PCDATA ) >

<!ELEMENT TestMaintenanceSummary (ActionMaintenanceSummary*) >
<!ATTLIST TestMaintenanceSummary ObjectsAdded CDATA #REQUIRED ObjectsUpdated CDATA #REQUIRED StepsUpdated CDATA #REQUIRED StepsComments CDATA #REQUIRED><!ELEMENT ActionMaintenanceSummary (ObjectChange* ) >
<!ATTLIST ActionMaintenanceSummary Action CDATA #REQUIRED Objects CDATA #REQUIRED Updated CDATA #REQUIRED LinesTotal CDATA #REQUIRED Added CDATA #REQUIRED LinesUpdated CDATA #REQUIRED>

<!ELEMENT ObjectChange  (Hierarchy, PropertyChangeList* ) >
<!ATTLIST ObjectChange Operation CDATA #IMPLIED OriginalRepository CDATA #IMPLIED>

<!ELEMENT PropertyChangeList (PropertyDef*) >

<!ELEMENT PropertyDef (OriginalValue, NewValue) >
<!ATTLIST PropertyDef PropName CDATA #REQUIRED OriginRegularExpression (True|False) "False" NewRegularExpression (True|False) "False" AddedProperty (True|False) "False" >

<!ELEMENT OriginalValue ( #PCDATA )>

<!ELEMENT NewValue ( #PCDATA )>

<!ELEMENT Hierarchy  (ObjectName, Hierarchy*) >
<!ATTLIST Hierarchy MicClass CDATA #REQUIRED>

<!ELEMENT ObjectName  ( #PCDATA ) >

<!ELEMENT Step (Obj,Details,Time,TimeTick* ,(Step|HtmlStep|Doc)*, DataMapping?, NodeArgs) >
<!ATTLIST Step rID ID #REQUIRED retval CDATA #IMPLIED>

<!ELEMENT HtmlStep (HTML,TimeTick*,(Step|HtmlStep|Doc)*,NodeArgs) >
<!ATTLIST HtmlStep rID ID #REQUIRED >

<!ELEMENT Obj ( #PCDATA ) >
<!ATTLIST Obj plainTxt (False|True) "True">

<!ELEMENT Details ( #PCDATA ) >
<!ATTLIST Details plainTxt (False|True) "True">

<!ELEMENT Time ( #PCDATA ) >

<!ELEMENT HTML ( #PCDATA ) >

<!ELEMENT Disp ( #PCDATA ) >

<!ELEMENT TimeTick ( #PCDATA ) >

<!ELEMENT DataMapping ( DataMappedItem* )>
<!ELEMENT DataMappedItem EMPTY >
<!ATTLIST DataMappedItem dsName CDATA #REQUIRED >
<!ATTLIST DataMappedItem rowId CDATA #REQUIRED >

<!ELEMENT NodeArgs (Disp,TopPane?,BtmPane?,ExtendedInfo? )>
<!ATTLIST NodeArgs eType CDATA #REQUIRED icon CDATA #REQUIRED nRep CDATA #REQUIRED UserNote CDATA #IMPLIED filter (False|True) "True">
<!ATTLIST NodeArgs status (Passed|Failed|Done|Warning|Information) "Done">
<!ATTLIST NodeArgs iconSel CDATA #IMPLIED nType CDATA #IMPLIED MovieMarker CDATA "">
<!ATTLIST NodeArgs Source CDATA #IMPLIED SourceLine CDATA #IMPLIED StepFlowItemKey CDATA #IMPLIED >

<!ELEMENT TopPane (Path)>

<!ELEMENT BtmPane ( (Path|WR)?,ASHilite?)>
<!ATTLIST BtmPane vType CDATA "HTML">

<!ELEMENT Path ( #PCDATA ) >

<!ELEMENT ASHilite ( #PCDATA ) >

<!ELEMENT WR ( #PCDATA ) >

<!ELEMENT ExtendedInfo ( StepData ) >

<!ATTLIST ExtendedInfo StepType CDATA #REQUIRED>
<!ELEMENT DT (NodeArgs) >
<!ATTLIST DT rID ID #REQUIRED>

<!ELEMENT Summary (Param*)>
<!ATTLIST Summary sTime CDATA #IMPLIED eTime CDATA #IMPLIED passed CDATA #IMPLIED failed CDATA #IMPLIED warnings CDATA #IMPLIED retval CDATA #IMPLIED stopped (False|True) "False" >

<!ELEMENT Param (ParamName,ParamVal)+ >
<!ATTLIST Param paramInOut (In|Out) "In">

<!ELEMENT ParamName ( #PCDATA ) >

<!ELEMENT ParamVal ( #PCDATA ) >

]
>
<Report ver="2.0" tmZone="Central Standard Time">
<General productName="HP Unified Functional Testing" productVer="12.02" os="Windows 7" host="GREGORYJ01"><DocLocation><![CDATA[D:\PROJECT_FOLDER\Testscripts\ReviewMedications]]></DocLocation></General>
<Doc rID="T1"   productName= "HP Unified Functional Testing"  >
<DName><![CDATA[ReviewMedications]]></DName>
<Res><![CDATA[Res5]]></Res>
<DT rID="T2">
<NodeArgs eType="Table" icon="2" nRep="4" filter="False" >
<Disp><![CDATA[Run-Time Data Table]]></Disp>
<BtmPane vType="Table" >
<Path><![CDATA[Default.xls]]></Path>
</BtmPane>
</NodeArgs>
</DT>
<DIter rID="T3" iterID="1" >
<Action rID="T4">
<AName><![CDATA[Action1]]></AName>
<Step rID="T5">
<Obj plainTxt="False" ><![CDATA[LoadFunctionLibrary]]></Obj>
<Details plainTxt="False" ><![CDATA[LoadFunctionLibrary function passed]]></Details>
<Time><![CDATA[11/17/2015 - 21:51:11]]></Time>
<TimeTick>1447818671</TimeTick>
<NodeArgs eType="Replay" icon="5" nRep="8" status="Passed" Source="Action1" SourceLine="21" >
<Disp><![CDATA[LoadFunctionLibrary]]></Disp>
</NodeArgs>
</Step>
<Step rID="T6">
<Obj plainTxt="False" ><![CDATA[LoadFunctionLibrary]]></Obj>
<Details plainTxt="False" ><![CDATA[LoadFunctionLibrary function passed]]></Details>
<Time><![CDATA[11/17/2015 - 21:51:11]]></Time>
<TimeTick>1447818671</TimeTick>
<NodeArgs eType="Replay" icon="5" nRep="9" status="Passed" Source="Action1" SourceLine="21" >
<Disp><![CDATA[LoadFunctionLibrary]]></Disp>
</NodeArgs>
</Step>
<Step rID="T7">
<Obj plainTxt="False" ><![CDATA[LoadFunctionLibrary]]></Obj>
<Details plainTxt="False" ><![CDATA[LoadFunctionLibrary function passed]]></Details>
<Time><![CDATA[11/17/2015 - 21:51:11]]></Time>
<TimeTick>1447818671</TimeTick>
<NodeArgs eType="Replay" icon="5" nRep="10" status="Passed" Source="Action1" SourceLine="21" >
<Disp><![CDATA[LoadFunctionLibrary]]></Disp>
</NodeArgs>
</Step>
<Step rID="T8">
<Obj plainTxt="False" ><![CDATA[[ Medications ].Click]]></Obj>
<Details plainTxt="False" ><![CDATA[]]></Details>
<Time><![CDATA[11/17/2015 - 21:51:12]]></Time>
<TimeTick>1447818672</TimeTick>
<NodeArgs eType="Replay" icon="6" nRep="13" >
<Disp><![CDATA[[ Medications ].Click]]></Disp>
</NodeArgs>
</Step>
<Step rID="T9">
<Obj plainTxt="False" ><![CDATA[[ Medications Management  ].Exist]]></Obj>
<Details plainTxt="False" ><![CDATA["Object exists"]]></Details>
<Time><![CDATA[11/17/2015 - 21:51:25]]></Time>
<TimeTick>1447818685</TimeTick>
<NodeArgs eType="Replay" icon="7" nRep="19" Source="Action1" SourceLine="118" >
<Disp><![CDATA[[ Medications Management  ].Exist]]></Disp>
</NodeArgs>
</Step>
<Step rID="T10">
<Obj plainTxt="False" ><![CDATA[[ Calcium Acetate (Phos Binder) Oral Tablet 667 MG ].Exist]]></Obj>
<Details plainTxt="False" ><![CDATA["Object exists"]]></Details>
<Time><![CDATA[11/17/2015 - 21:51:27]]></Time>
<TimeTick>1447818687</TimeTick>
<NodeArgs eType="Replay" icon="8" nRep="21" Source="Action1" SourceLine="131" >
<Disp><![CDATA[[ Calcium Acetate (Phos Binder) Oral Tablet 667 MG ].Exist]]></Disp>
</NodeArgs>
</Step>
<Step rID="T11">
<Obj plainTxt="False" ><![CDATA["[ Calcium Acetate (Phos Binder) Oral Tablet 667 MG ]":Function Call]]></Obj>
<Details plainTxt="False" ><![CDATA[ChildItem]]></Details>
<Time><![CDATA[11/17/2015 - 21:51:27]]></Time>
<TimeTick>1447818687</TimeTick>
<NodeArgs eType="General" icon="8" nRep="22" >
<Disp><![CDATA["[ Calcium Acetate (Phos Binder) Oral Tablet 667 MG ]":Function Call]]></Disp>
</NodeArgs>
</Step>
<Step rID="T12">
<Obj plainTxt="False" ><![CDATA["[ Calcium Acetate (Phos Binder) Oral Tablet 667 MG ]":Function Call]]></Obj>
<Details plainTxt="False" ><![CDATA[RowCount]]></Details>
<Time><![CDATA[11/17/2015 - 21:51:27]]></Time>
<TimeTick>1447818687</TimeTick>
<NodeArgs eType="General" icon="8" nRep="23" >
<Disp><![CDATA["[ Calcium Acetate (Phos Binder) Oral Tablet 667 MG ]":Function Call]]></Disp>
</NodeArgs>
</Step>
<Step rID="T13">
<Obj plainTxt="False" ><![CDATA["[ Calcium Acetate (Phos Binder) Oral Tablet 667 MG ]":Function Call]]></Obj>
<Details plainTxt="False" ><![CDATA[ChildItem]]></Details>
<Time><![CDATA[11/17/2015 - 21:51:27]]></Time>
<TimeTick>1447818687</TimeTick>
<NodeArgs eType="General" icon="8" nRep="24" >
<Disp><![CDATA["[ Calcium Acetate (Phos Binder) Oral Tablet 667 MG ]":Function Call]]></Disp>
</NodeArgs>
</Step>
<Step rID="T14">
<Obj plainTxt="False" ><![CDATA[[ WebElement ].Click]]></Obj>
<Details plainTxt="False" ><![CDATA[]]></Details>
<Time><![CDATA[11/17/2015 - 21:51:27]]></Time>
<TimeTick>1447818687</TimeTick>
<NodeArgs eType="Replay" icon="7" nRep="26" Source="Action1" SourceLine="137" >
<Disp><![CDATA[[ WebElement ].Click]]></Disp>
</NodeArgs>
</Step>
<Step rID="T15">
<Obj plainTxt="False" ><![CDATA[[   Add ].Exist]]></Obj>
<Details plainTxt="False" ><![CDATA["Object exists"]]></Details>
<Time><![CDATA[11/17/2015 - 21:51:27]]></Time>
<TimeTick>1447818687</TimeTick>
<NodeArgs eType="Replay" icon="7" nRep="28" >
<Disp><![CDATA[[   Add ].Exist]]></Disp>
</NodeArgs>
</Step>
<Step rID="T16">
<Obj plainTxt="False" ><![CDATA[[   Add ].Click]]></Obj>
<Details plainTxt="False" ><![CDATA[]]></Details>
<Time><![CDATA[11/17/2015 - 21:51:27]]></Time>
<TimeTick>1447818687</TimeTick>
<NodeArgs eType="Replay" icon="7" nRep="30" >
<Disp><![CDATA[[   Add ].Click]]></Disp>
</NodeArgs>
</Step>
<Step rID="T17">
<Obj plainTxt="False" ><![CDATA[[   ].Click]]></Obj>
<Details plainTxt="False" ><![CDATA[]]></Details>
<Time><![CDATA[11/17/2015 - 21:51:31]]></Time>
<TimeTick>1447818691</TimeTick>
<NodeArgs eType="Replay" icon="7" nRep="34" Source="Action1" SourceLine="171" >
<Disp><![CDATA[[   ].Click]]></Disp>
</NodeArgs>
</Step>
<Step rID="T18">
<Obj plainTxt="False" ><![CDATA[[ Hematide ].Click]]></Obj>
<Details plainTxt="False" ><![CDATA[]]></Details>
<Time><![CDATA[11/17/2015 - 21:51:45]]></Time>
<TimeTick>1447818705</TimeTick>
<NodeArgs eType="Replay" icon="6" nRep="40" >
<Disp><![CDATA[[ Hematide ].Click]]></Disp>
</NodeArgs>
</Step>
<Step rID="T19">
<Obj plainTxt="False" ><![CDATA[[ WebEdit ].Set]]></Obj>
<Details plainTxt="False" ><![CDATA["11/10/2015"]]></Details>
<Time><![CDATA[11/17/2015 - 21:51:49]]></Time>
<TimeTick>1447818709</TimeTick>
<NodeArgs eType="Replay" icon="9" nRep="43" Source="Action1" SourceLine="191" >
<Disp><![CDATA[[ WebEdit ].Set]]></Disp>
</NodeArgs>
</Step>
<Step rID="T20">
<Obj plainTxt="False" ><![CDATA[[ WebEdit ].Set]]></Obj>
<Details plainTxt="False" ><![CDATA["11/10/2015"]]></Details>
<Time><![CDATA[11/17/2015 - 21:51:51]]></Time>
<TimeTick>1447818711</TimeTick>
<NodeArgs eType="Replay" icon="9" nRep="46" Source="Action1" SourceLine="201" >
<Disp><![CDATA[[ WebEdit ].Set]]></Disp>
</NodeArgs>
</Step>
<Step rID="T21">
<Obj plainTxt="False" ><![CDATA[[ WITH MEALS  ].Click]]></Obj>
<Details plainTxt="False" ><![CDATA[]]></Details>
<Time><![CDATA[11/17/2015 - 21:51:52]]></Time>
<TimeTick>1447818712</TimeTick>
<NodeArgs eType="Replay" icon="10" nRep="49" >
<Disp><![CDATA[[ WITH MEALS  ].Click]]></Disp>
</NodeArgs>
</Step>
<Step rID="T22">
<Obj plainTxt="False" ><![CDATA[[ AFTER EATING ].Click]]></Obj>
<Details plainTxt="False" ><![CDATA[]]></Details>
<Time><![CDATA[11/17/2015 - 21:51:54]]></Time>
<TimeTick>1447818714</TimeTick>
<NodeArgs eType="Replay" icon="6" nRep="52" >
<Disp><![CDATA[[ AFTER EATING ].Click]]></Disp>
</NodeArgs>
</Step>
<Step rID="T23">
<Obj plainTxt="False" ><![CDATA[[  Save   ].Exist]]></Obj>
<Details plainTxt="False" ><![CDATA["Object exists"]]></Details>
<Time><![CDATA[11/17/2015 - 21:51:58]]></Time>
<TimeTick>1447818718</TimeTick>
<NodeArgs eType="Replay" icon="7" nRep="54" >
<Disp><![CDATA[[  Save   ].Exist]]></Disp>
</NodeArgs>
</Step>
<Step rID="T24">
<Obj plainTxt="False" ><![CDATA[[  Save   ].Click]]></Obj>
<Details plainTxt="False" ><![CDATA[]]></Details>
<Time><![CDATA[11/17/2015 - 21:51:58]]></Time>
<TimeTick>1447818718</TimeTick>
<NodeArgs eType="Replay" icon="7" nRep="56" >
<Disp><![CDATA[[  Save   ].Click]]></Disp>
</NodeArgs>
</Step>
<Step rID="T25">
<Obj plainTxt="False" ><![CDATA[[ Processing... ].Exist]]></Obj>
<Details plainTxt="False" ><![CDATA["Object exists"]]></Details>
<Time><![CDATA[11/17/2015 - 21:51:58]]></Time>
<TimeTick>1447818718</TimeTick>
<NodeArgs eType="Replay" icon="7" nRep="57" Source="Action1" SourceLine="669" >
<Disp><![CDATA[[ Processing... ].Exist]]></Disp>
</NodeArgs>
</Step>
<Step rID="T26">
<Obj plainTxt="False" ><![CDATA[[ Processing... ].Exist]]></Obj>
<Details plainTxt="False" ><![CDATA["Object exists"]]></Details>
<Time><![CDATA[11/17/2015 - 21:51:59]]></Time>
<TimeTick>1447818719</TimeTick>
<NodeArgs eType="Replay" icon="7" nRep="58" Source="Action1" SourceLine="669" >
<Disp><![CDATA[[ Processing... ].Exist]]></Disp>
</NodeArgs>
</Step>
<Step rID="T27">
<Obj plainTxt="False" ><![CDATA[[ Processing... ].Exist]]></Obj>
<Details plainTxt="False" ><![CDATA["Object exists"]]></Details>
<Time><![CDATA[11/17/2015 - 21:52:00]]></Time>
<TimeTick>1447818720</TimeTick>
<NodeArgs eType="Replay" icon="7" nRep="59" Source="Action1" SourceLine="669" >
<Disp><![CDATA[[ Processing... ].Exist]]></Disp>
</NodeArgs>
</Step>
<Step rID="T28">
<Obj plainTxt="False" ><![CDATA[[ Processing... ].Exist]]></Obj>
<Details plainTxt="False" ><![CDATA["Object exists"]]></Details>
<Time><![CDATA[11/17/2015 - 21:52:02]]></Time>
<TimeTick>1447818722</TimeTick>
<NodeArgs eType="Replay" icon="7" nRep="60" Source="Action1" SourceLine="669" >
<Disp><![CDATA[[ Processing... ].Exist]]></Disp>
</NodeArgs>
</Step>
<Step rID="T29">
<Obj plainTxt="False" ><![CDATA[[ Processing... ].Exist]]></Obj>
<Details plainTxt="False" ><![CDATA["Object exists"]]></Details>
<Time><![CDATA[11/17/2015 - 21:52:03]]></Time>
<TimeTick>1447818723</TimeTick>
<NodeArgs eType="Replay" icon="7" nRep="61" Source="Action1" SourceLine="669" >
<Disp><![CDATA[[ Processing... ].Exist]]></Disp>
</NodeArgs>
</Step>
<Step rID="T30">
<Obj plainTxt="False" ><![CDATA[[ Processing... ].Exist]]></Obj>
<Details plainTxt="False" ><![CDATA["Object exists"]]></Details>
<Time><![CDATA[11/17/2015 - 21:52:04]]></Time>
<TimeTick>1447818724</TimeTick>
<NodeArgs eType="Replay" icon="7" nRep="62" Source="Action1" SourceLine="669" >
<Disp><![CDATA[[ Processing... ].Exist]]></Disp>
</NodeArgs>
</Step>
<Step rID="T31">
<Obj plainTxt="False" ><![CDATA[[ Processing... ].Exist]]></Obj>
<Details plainTxt="False" ><![CDATA["Object exists"]]></Details>
<Time><![CDATA[11/17/2015 - 21:52:05]]></Time>
<TimeTick>1447818725</TimeTick>
<NodeArgs eType="Replay" icon="7" nRep="63" Source="Action1" SourceLine="669" >
<Disp><![CDATA[[ Processing... ].Exist]]></Disp>
</NodeArgs>
</Step>
<Step rID="T32">
<Obj plainTxt="False" ><![CDATA[[ Processing... ].Exist]]></Obj>
<Details plainTxt="False" ><![CDATA["Object exists"]]></Details>
<Time><![CDATA[11/17/2015 - 21:52:06]]></Time>
<TimeTick>1447818726</TimeTick>
<NodeArgs eType="Replay" icon="7" nRep="64" Source="Action1" SourceLine="669" >
<Disp><![CDATA[[ Processing... ].Exist]]></Disp>
</NodeArgs>
</Step>
<Step rID="T33">
<Obj plainTxt="False" ><![CDATA[[ Processing... ].Exist]]></Obj>
<Details plainTxt="False" ><![CDATA["Object exists"]]></Details>
<Time><![CDATA[11/17/2015 - 21:52:07]]></Time>
<TimeTick>1447818727</TimeTick>
<NodeArgs eType="Replay" icon="7" nRep="65" Source="Action1" SourceLine="669" >
<Disp><![CDATA[[ Processing... ].Exist]]></Disp>
</NodeArgs>
</Step>
<Step rID="T34">
<Obj plainTxt="False" ><![CDATA[[ Processing... ].Exist]]></Obj>
<Details plainTxt="False" ><![CDATA["Object exists"]]></Details>
<Time><![CDATA[11/17/2015 - 21:52:09]]></Time>
<TimeTick>1447818729</TimeTick>
<NodeArgs eType="Replay" icon="7" nRep="66" Source="Action1" SourceLine="669" >
<Disp><![CDATA[[ Processing... ].Exist]]></Disp>
</NodeArgs>
</Step>
<Step rID="T35">
<Obj plainTxt="False" ><![CDATA[[ Processing... ].Exist]]></Obj>
<Details plainTxt="False" ><![CDATA["Object exists"]]></Details>
<Time><![CDATA[11/17/2015 - 21:52:10]]></Time>
<TimeTick>1447818730</TimeTick>
<NodeArgs eType="Replay" icon="7" nRep="67" Source="Action1" SourceLine="669" >
<Disp><![CDATA[[ Processing... ].Exist]]></Disp>
</NodeArgs>
</Step>
<Step rID="T36">
<Obj plainTxt="False" ><![CDATA[[ Processing... ].Exist]]></Obj>
<Details plainTxt="False" ><![CDATA["Object exists"]]></Details>
<Time><![CDATA[11/17/2015 - 21:52:11]]></Time>
<TimeTick>1447818731</TimeTick>
<NodeArgs eType="Replay" icon="7" nRep="68" Source="Action1" SourceLine="669" >
<Disp><![CDATA[[ Processing... ].Exist]]></Disp>
</NodeArgs>
</Step>
<Step rID="T37">
<Obj plainTxt="False" ><![CDATA[[ Processing... ].Exist]]></Obj>
<Details plainTxt="False" ><![CDATA["Object exists"]]></Details>
<Time><![CDATA[11/17/2015 - 21:52:12]]></Time>
<TimeTick>1447818732</TimeTick>
<NodeArgs eType="Replay" icon="7" nRep="69" Source="Action1" SourceLine="669" >
<Disp><![CDATA[[ Processing... ].Exist]]></Disp>
</NodeArgs>
</Step>
<Step rID="T38">
<Obj plainTxt="False" ><![CDATA[[ Processing... ].Exist]]></Obj>
<Details plainTxt="False" ><![CDATA["Object exists"]]></Details>
<Time><![CDATA[11/17/2015 - 21:52:13]]></Time>
<TimeTick>1447818733</TimeTick>
<NodeArgs eType="Replay" icon="7" nRep="70" Source="Action1" SourceLine="669" >
<Disp><![CDATA[[ Processing... ].Exist]]></Disp>
</NodeArgs>
</Step>
<Step rID="T39">
<Obj plainTxt="False" ><![CDATA[[ Processing... ].Exist]]></Obj>
<Details plainTxt="False" ><![CDATA["Object exists"]]></Details>
<Time><![CDATA[11/17/2015 - 21:52:14]]></Time>
<TimeTick>1447818734</TimeTick>
<NodeArgs eType="Replay" icon="7" nRep="71" Source="Action1" SourceLine="669" >
<Disp><![CDATA[[ Processing... ].Exist]]></Disp>
</NodeArgs>
</Step>
<Step rID="T40">
<Obj plainTxt="False" ><![CDATA[[ Processing... ].Exist]]></Obj>
<Details plainTxt="False" ><![CDATA["Object exists"]]></Details>
<Time><![CDATA[11/17/2015 - 21:52:16]]></Time>
<TimeTick>1447818736</TimeTick>
<NodeArgs eType="Replay" icon="7" nRep="72" Source="Action1" SourceLine="669" >
<Disp><![CDATA[[ Processing... ].Exist]]></Disp>
</NodeArgs>
</Step>
<Step rID="T41">
<Obj plainTxt="False" ><![CDATA[[ Processing... ].Exist]]></Obj>
<Details plainTxt="False" ><![CDATA["Object exists"]]></Details>
<Time><![CDATA[11/17/2015 - 21:52:17]]></Time>
<TimeTick>1447818737</TimeTick>
<NodeArgs eType="Replay" icon="7" nRep="73" Source="Action1" SourceLine="669" >
<Disp><![CDATA[[ Processing... ].Exist]]></Disp>
</NodeArgs>
</Step>
<Step rID="T42">
<Obj plainTxt="False" ><![CDATA[[ Processing... ].Exist]]></Obj>
<Details plainTxt="False" ><![CDATA["Object exists"]]></Details>
<Time><![CDATA[11/17/2015 - 21:52:18]]></Time>
<TimeTick>1447818738</TimeTick>
<NodeArgs eType="Replay" icon="7" nRep="74" Source="Action1" SourceLine="669" >
<Disp><![CDATA[[ Processing... ].Exist]]></Disp>
</NodeArgs>
</Step>
<Step rID="T43">
<Obj plainTxt="False" ><![CDATA[[ Processing... ].Exist]]></Obj>
<Details plainTxt="False" ><![CDATA["Object exists"]]></Details>
<Time><![CDATA[11/17/2015 - 21:52:19]]></Time>
<TimeTick>1447818739</TimeTick>
<NodeArgs eType="Replay" icon="7" nRep="75" Source="Action1" SourceLine="669" >
<Disp><![CDATA[[ Processing... ].Exist]]></Disp>
</NodeArgs>
</Step>
<Step rID="T44">
<Obj plainTxt="False" ><![CDATA[[ Processing... ].Exist]]></Obj>
<Details plainTxt="False" ><![CDATA["Object exists"]]></Details>
<Time><![CDATA[11/17/2015 - 21:52:20]]></Time>
<TimeTick>1447818740</TimeTick>
<NodeArgs eType="Replay" icon="7" nRep="76" Source="Action1" SourceLine="669" >
<Disp><![CDATA[[ Processing... ].Exist]]></Disp>
</NodeArgs>
</Step>
<Step rID="T45">
<Obj plainTxt="False" ><![CDATA[[ Processing... ].Exist]]></Obj>
<Details plainTxt="False" ><![CDATA["Object exists"]]></Details>
<Time><![CDATA[11/17/2015 - 21:52:21]]></Time>
<TimeTick>1447818741</TimeTick>
<NodeArgs eType="Replay" icon="7" nRep="77" Source="Action1" SourceLine="669" >
<Disp><![CDATA[[ Processing... ].Exist]]></Disp>
</NodeArgs>
</Step>
<Step rID="T46">
<Obj plainTxt="False" ><![CDATA[[ Processing... ].Exist]]></Obj>
<Details plainTxt="False" ><![CDATA["Object exists"]]></Details>
<Time><![CDATA[11/17/2015 - 21:52:23]]></Time>
<TimeTick>1447818743</TimeTick>
<NodeArgs eType="Replay" icon="7" nRep="78" Source="Action1" SourceLine="669" >
<Disp><![CDATA[[ Processing... ].Exist]]></Disp>
</NodeArgs>
</Step>
<Step rID="T47">
<Obj plainTxt="False" ><![CDATA[[ Processing... ].Exist]]></Obj>
<Details plainTxt="False" ><![CDATA["Object exists"]]></Details>
<Time><![CDATA[11/17/2015 - 21:52:24]]></Time>
<TimeTick>1447818744</TimeTick>
<NodeArgs eType="Replay" icon="7" nRep="79" Source="Action1" SourceLine="669" >
<Disp><![CDATA[[ Processing... ].Exist]]></Disp>
</NodeArgs>
</Step>
<Step rID="T48">
<Obj plainTxt="False" ><![CDATA[[ Processing... ].Exist]]></Obj>
<Details plainTxt="False" ><![CDATA["Object exists"]]></Details>
<Time><![CDATA[11/17/2015 - 21:52:25]]></Time>
<TimeTick>1447818745</TimeTick>
<NodeArgs eType="Replay" icon="7" nRep="80" Source="Action1" SourceLine="669" >
<Disp><![CDATA[[ Processing... ].Exist]]></Disp>
</NodeArgs>
</Step>
<Step rID="T49">
<Obj plainTxt="False" ><![CDATA[[ Processing... ].Exist]]></Obj>
<Details plainTxt="False" ><![CDATA["Object exists"]]></Details>
<Time><![CDATA[11/17/2015 - 21:52:26]]></Time>
<TimeTick>1447818746</TimeTick>
<NodeArgs eType="Replay" icon="7" nRep="81" Source="Action1" SourceLine="669" >
<Disp><![CDATA[[ Processing... ].Exist]]></Disp>
</NodeArgs>
</Step>
<Step rID="T50">
<Obj plainTxt="False" ><![CDATA[[ Processing... ].Exist]]></Obj>
<Details plainTxt="False" ><![CDATA["Object exists"]]></Details>
<Time><![CDATA[11/17/2015 - 21:52:27]]></Time>
<TimeTick>1447818747</TimeTick>
<NodeArgs eType="Replay" icon="7" nRep="82" Source="Action1" SourceLine="669" >
<Disp><![CDATA[[ Processing... ].Exist]]></Disp>
</NodeArgs>
</Step>
<Step rID="T51">
<Obj plainTxt="False" ><![CDATA[[ Processing... ].Exist]]></Obj>
<Details plainTxt="False" ><![CDATA["Object exists"]]></Details>
<Time><![CDATA[11/17/2015 - 21:52:28]]></Time>
<TimeTick>1447818748</TimeTick>
<NodeArgs eType="Replay" icon="7" nRep="83" Source="Action1" SourceLine="669" >
<Disp><![CDATA[[ Processing... ].Exist]]></Disp>
</NodeArgs>
</Step>
<Step rID="T52">
<Obj plainTxt="False" ><![CDATA[[ Processing... ].Exist]]></Obj>
<Details plainTxt="False" ><![CDATA["Object exists"]]></Details>
<Time><![CDATA[11/17/2015 - 21:52:30]]></Time>
<TimeTick>1447818750</TimeTick>
<NodeArgs eType="Replay" icon="7" nRep="84" Source="Action1" SourceLine="669" >
<Disp><![CDATA[[ Processing... ].Exist]]></Disp>
</NodeArgs>
</Step>
<Step rID="T53">
<Obj plainTxt="False" ><![CDATA[[ Processing... ].Exist]]></Obj>
<Details plainTxt="False" ><![CDATA["Object exists"]]></Details>
<Time><![CDATA[11/17/2015 - 21:52:31]]></Time>
<TimeTick>1447818751</TimeTick>
<NodeArgs eType="Replay" icon="7" nRep="85" Source="Action1" SourceLine="669" >
<Disp><![CDATA[[ Processing... ].Exist]]></Disp>
</NodeArgs>
</Step>
<Step rID="T54">
<Obj plainTxt="False" ><![CDATA[[ Processing... ].Exist]]></Obj>
<Details plainTxt="False" ><![CDATA["Object exists"]]></Details>
<Time><![CDATA[11/17/2015 - 21:52:32]]></Time>
<TimeTick>1447818752</TimeTick>
<NodeArgs eType="Replay" icon="7" nRep="86" Source="Action1" SourceLine="669" >
<Disp><![CDATA[[ Processing... ].Exist]]></Disp>
</NodeArgs>
</Step>
<Step rID="T55">
<Obj plainTxt="False" ><![CDATA[[ Processing... ].Exist]]></Obj>
<Details plainTxt="False" ><![CDATA["Object exists"]]></Details>
<Time><![CDATA[11/17/2015 - 21:52:33]]></Time>
<TimeTick>1447818753</TimeTick>
<NodeArgs eType="Replay" icon="7" nRep="87" Source="Action1" SourceLine="669" >
<Disp><![CDATA[[ Processing... ].Exist]]></Disp>
</NodeArgs>
</Step>
<Step rID="T56">
<Obj plainTxt="False" ><![CDATA[[ Processing... ].Exist]]></Obj>
<Details plainTxt="False" ><![CDATA["Object exists"]]></Details>
<Time><![CDATA[11/17/2015 - 21:52:34]]></Time>
<TimeTick>1447818754</TimeTick>
<NodeArgs eType="Replay" icon="7" nRep="88" Source="Action1" SourceLine="669" >
<Disp><![CDATA[[ Processing... ].Exist]]></Disp>
</NodeArgs>
</Step>
<Step rID="T57">
<Obj plainTxt="False" ><![CDATA[[ Processing... ].Exist]]></Obj>
<Details plainTxt="False" ><![CDATA["Object exists"]]></Details>
<Time><![CDATA[11/17/2015 - 21:52:35]]></Time>
<TimeTick>1447818755</TimeTick>
<NodeArgs eType="Replay" icon="7" nRep="89" Source="Action1" SourceLine="669" >
<Disp><![CDATA[[ Processing... ].Exist]]></Disp>
</NodeArgs>
</Step>
<Step rID="T58">
<Obj plainTxt="False" ><![CDATA[[ Processing... ].Exist]]></Obj>
<Details plainTxt="False" ><![CDATA["Object exists"]]></Details>
<Time><![CDATA[11/17/2015 - 21:52:37]]></Time>
<TimeTick>1447818757</TimeTick>
<NodeArgs eType="Replay" icon="7" nRep="90" Source="Action1" SourceLine="669" >
<Disp><![CDATA[[ Processing... ].Exist]]></Disp>
</NodeArgs>
</Step>
<Step rID="T59">
<Obj plainTxt="False" ><![CDATA[[ Processing... ].Exist]]></Obj>
<Details plainTxt="False" ><![CDATA["Object exists"]]></Details>
<Time><![CDATA[11/17/2015 - 21:52:38]]></Time>
<TimeTick>1447818758</TimeTick>
<NodeArgs eType="Replay" icon="7" nRep="91" Source="Action1" SourceLine="669" >
<Disp><![CDATA[[ Processing... ].Exist]]></Disp>
</NodeArgs>
</Step>
<Step rID="T60">
<Obj plainTxt="False" ><![CDATA[[ Processing... ].Exist]]></Obj>
<Details plainTxt="False" ><![CDATA["Object exists"]]></Details>
<Time><![CDATA[11/17/2015 - 21:52:39]]></Time>
<TimeTick>1447818759</TimeTick>
<NodeArgs eType="Replay" icon="7" nRep="92" Source="Action1" SourceLine="669" >
<Disp><![CDATA[[ Processing... ].Exist]]></Disp>
</NodeArgs>
</Step>
<Step rID="T61">
<Obj plainTxt="False" ><![CDATA[[ Processing... ].Exist]]></Obj>
<Details plainTxt="False" ><![CDATA["Object exists"]]></Details>
<Time><![CDATA[11/17/2015 - 21:52:40]]></Time>
<TimeTick>1447818760</TimeTick>
<NodeArgs eType="Replay" icon="7" nRep="93" Source="Action1" SourceLine="669" >
<Disp><![CDATA[[ Processing... ].Exist]]></Disp>
</NodeArgs>
</Step>
<Step rID="T62">
<Obj plainTxt="False" ><![CDATA[[ Processing... ].Exist]]></Obj>
<Details plainTxt="False" ><![CDATA["Object exists"]]></Details>
<Time><![CDATA[11/17/2015 - 21:52:41]]></Time>
<TimeTick>1447818761</TimeTick>
<NodeArgs eType="Replay" icon="7" nRep="94" Source="Action1" SourceLine="669" >
<Disp><![CDATA[[ Processing... ].Exist]]></Disp>
</NodeArgs>
</Step>
<Step rID="T63">
<Obj plainTxt="False" ><![CDATA[[ Processing... ].Exist]]></Obj>
<Details plainTxt="False" ><![CDATA["Object exists"]]></Details>
<Time><![CDATA[11/17/2015 - 21:52:42]]></Time>
<TimeTick>1447818762</TimeTick>
<NodeArgs eType="Replay" icon="7" nRep="95" Source="Action1" SourceLine="669" >
<Disp><![CDATA[[ Processing... ].Exist]]></Disp>
</NodeArgs>
</Step>
<Step rID="T64">
<Obj plainTxt="False" ><![CDATA[[ Processing... ].Exist]]></Obj>
<Details plainTxt="False" ><![CDATA["Object exists"]]></Details>
<Time><![CDATA[11/17/2015 - 21:52:44]]></Time>
<TimeTick>1447818764</TimeTick>
<NodeArgs eType="Replay" icon="7" nRep="96" Source="Action1" SourceLine="669" >
<Disp><![CDATA[[ Processing... ].Exist]]></Disp>
</NodeArgs>
</Step>
<Step rID="T65">
<Obj plainTxt="False" ><![CDATA[[ Processing... ].Exist]]></Obj>
<Details plainTxt="False" ><![CDATA["Object exists"]]></Details>
<Time><![CDATA[11/17/2015 - 21:52:45]]></Time>
<TimeTick>1447818765</TimeTick>
<NodeArgs eType="Replay" icon="7" nRep="97" Source="Action1" SourceLine="669" >
<Disp><![CDATA[[ Processing... ].Exist]]></Disp>
</NodeArgs>
</Step>
<Step rID="T66">
<Obj plainTxt="False" ><![CDATA[[ WebElement ].Exist]]></Obj>
<Details plainTxt="False" ><![CDATA["Object does not exist"]]></Details>
<Time><![CDATA[11/17/2015 - 21:52:47]]></Time>
<TimeTick>1447818767</TimeTick>
<NodeArgs eType="Replay" icon="7" nRep="105" Source="Action1" SourceLine="669" >
<Disp><![CDATA[[ WebElement ].Exist]]></Disp>
</NodeArgs>
</Step>
<Step rID="T67">
<Obj plainTxt="False" ><![CDATA[Stop Run]]></Obj>
<Details plainTxt="False" ><![CDATA[Run stopped by user.]]></Details>
<Time><![CDATA[11/17/2015 - 21:52:47]]></Time>
<TimeTick>1447818767</TimeTick>
<NodeArgs eType="General" icon="11" nRep="106" >
<Disp><![CDATA[Stop Run]]></Disp>
</NodeArgs>
</Step>
<Summary sTime="11/17/2015 - 21:51:10" eTime="11/17/2015 - 21:52:47" passed="3" failed="0" warnings="0" ></Summary>
<NodeArgs eType="StartAction" icon="4" nRep="7" status="Passed" >
<Disp><![CDATA[Action1 Summary]]></Disp>
</NodeArgs>
</Action>
<NodeArgs eType="StartIteration" icon="3" nRep="6" status="Passed" >
<Disp><![CDATA[ReviewMedications Iteration 1 (Row 1)]]></Disp>
</NodeArgs>
</DIter>
<Step rID="T68">
<Obj plainTxt="False" ><![CDATA[Stop Run]]></Obj>
<Details plainTxt="False" ><![CDATA[Run stopped by user.]]></Details>
<Time><![CDATA[11/17/2015 - 21:52:47]]></Time>
<TimeTick>1447818767</TimeTick>
<NodeArgs eType="General" icon="12" nRep="109" >
<Disp><![CDATA[Stop Run]]></Disp>
</NodeArgs>
</Step>
<Summary sTime="11/17/2015 - 21:51:09" eTime="11/17/2015 - 21:52:47" passed="3" failed="0" warnings="0" stopped="True" ></Summary>
<NodeArgs eType="StartTest" icon="1" nRep="3" status="Passed" >
<Disp><![CDATA[Test ReviewMedications Summary]]></Disp>
</NodeArgs>
</Doc>
</Report>